LV2022133064¡Disproportionation enabling reversible MnO2/Mn2+ transformation in a mild aqueous Zn-MnO2 hybrid battery¡Disproportionation= Zn-MnO hybrid battery= Mechanism= Deposition/dissolution¡The disproportionation of the Jahn-Teller (J-T) active manganese oxides (Mn3+) often leads to uncontrollable Mn2+ dissolution, which has been identified as one of the major causes of the performance degradation in conventional Zn-MnO2 batteries. Herein, we use the “unwanted” disproportionation of the Mn3+ cations to realize effective MnO2/Mn2+ transformation, achieving high specific capacity (550 mAh g−1) and good cycling stability (5000 cycles without capacity decay) in a Zn-MnO2 hybrid battery with mild aqueous electrolytes. Mechanism study shows that MnO2 is deposited on the cathode during charging, H+/Zn2+ insertion and disproportionation occur sequentially during discharging, leading to Mn2+ dissolution. The generated high-valence manganese oxides via disproportionation further experience reduction-disproportionation-dissolution, which proceeds repeatedly in the expanded discharge potential to 0 V vs. Zn2+/Zn, resulting in the complete dissolution of the cathodic materials. Our results provide the fundamental understanding on the controversial mechanisms of Zn-MnO2 batteries with mild aqueous electrolytes and highlight the effect of disproportionation in pushing the electrochemical performance of the promising Zn-MnO2 hybrid batteries.
OROZCOMENA2022133072¡Implementing a sustainable photochemical step to produce value-added products in flue gas desulfurization¡Flue Gas Desulfurization= Life Cycle Assessment= Process Simulation= Sulfite Photooxidation¡Coal consumption has led to a worrying surge in flue gas emissions, aggravating health and environmental issues worldwide. Therefore, novel approaches supported by sustainable technologies are needed to exploit flue gas emissions effectively. Here, we evaluate an ammonia-based flue gas desulfurization process based on the photochemical capture of CO2 and SO2 for producing hydrogen and ammonium-based fertilizers. The kinetics and mechanistic pathways for sulfite photooxidation are examined, while process feasibility and environmental relevance are evaluated by process simulation and life cycle assessment. Results show that increasing the initial sulfite concentration results in faster reaction rates, following first-order kinetics with an activation energy of 32.9 kJ/mol. Moreover, kinetics is ascribed to two competing photoinduced radical-mediated reaction pathways. Finally, powering the process by renewable energy leads to positive human health, ecosystems, and resources scores in life cycle assessment, supporting the sustainability of the process. Overall, this approach offers essential insights for large-scale hydrogen production through the photooxidation of captured flue gas emissions.
YAN2022132955¡Amorphous aerogel of trimetallic FeCoNi alloy for highly efficient oxygen evolution¡Trimetallic alloy= Aerogel= Amorphous= Electrocatalyst¡Developing highly efficient, cost-effective and extremely stable electrocatalysts toward oxygen evolution reaction (OER) is a great challenge for their promising water splitting application to promote the sluggish kinetics. In this work, an amorphous non-noble FeCoNi trimetallic aerogel (FeCoNi AG) is prepared via a one-step in situ spontaneous gelation and reduction strategy, presenting a remarkable OER activity and stability in an alkaline medium. FeCoNi AG catalyst delivers an exceptionally low overpotential of 235 mV at a current density of 10 mA cm−2 and features a small Tafel slope of 50 mV dec-1 in 1 M KOH, which is superior to the state-of-the-art RuO2 and many other reported transition FeCoNi-based catalysts. In addition, an outstanding long-term durability during 40 h chronoamperometric test and 5000 cyclic voltammetry (CV) cycles without obvious degradation of current density is achieved. This work is of high inspiration for developing transition metals-based amorphous aerogel electrocatalysts for greatly enhanced oxygen evolution.
DONG2022133007¡Engineering attractive interaction in ZIF-based phase change materials for boosting electro- and photo- driven thermal energy storage¡Phase change materials= Energy storage materials= Electro-heat storage= Photo-heat storage¡Metal organic frameworks contain abundant empty space for selectively absorbing phase change materials (PCM) molecules and sometimes chemically transformed. However, the strong attractive interaction between metal organic frameworks and PCM severely blocks sufficient crystalline-amorphous state transition of PCM. Herein, we proposed an attractive interaction engineering strategy on hierarchical zeolitic imidazolate frameworks (ZIF) based phase change materials (polyethylene glycol/carbon cloth@ZIF, PEG/CC@ZIF) for boosting crystalline-amorphous state transition behavior and electro-/photo- driven thermal performance. Carboxyl-modified CC scaffold regulates attractive interaction between ZIF and PEG, which enhances energy storage capacity of the phase change composite. Moreover, ZIF nanoflakes deposited on the surface of CC reduce the convective heat loss at the solid–gas interface, and CC scaffold facilitates electron transportation and photon penetration, thus significantly enhancing electro- and photo- driven thermal energy storage. Furthermore, ZIF-induced chain effect between PEG and CC enhances the mechanical properties of PEG/CC@ZIF. Notably, commercially available transition metal oxide photocatalyst can be uniformly sprayed on the surface of PEG/CC@ZIF through coordination chemical engineering for multi-functional phase change composite.
ZANCO2022131000¡Heat transfer intensification with packed open-cell foams in TSA processes for CO2 capture¡TSA= Packed foam= Open-cell foam¡Packed open-cell foams are proposed as an alternative to standard packed bed configuration commonly adopted for the adsorption columns of a temperature swing adsorption process. In this contribution, heat transfer in an adsorption column with a packed foam configuration is investigated by experimental and modeling analysis, in comparison to a standard packed bed. The introduction of the packed foam allows for more rapid temperature transitions and substantial reduction of temperature gradients within the adsorption bed. The impact of this heat transfer enhancement on the separation performance of a temperature swing adsorption process is evaluated by modeling an example post-combustion CO2 capture application. Although the presence of the foam implies a loss of sorbent inventory (-26.5%), higher process productivity (+80%) is achieved thanks to faster temperature swings and more homogeneous temperature distribution within the adsorption columns.
JIANG2022132939¡Contrasting effects of microplastic aging upon the adsorption of sulfonamides and its mechanism¡Microplastic= Aging= Sulfonamides¡The aging behavior of microplastics (MPs) is unavoidable in the natural environment, but the mechanisms underlying the differences in MP aging affecting the adsorption performance of different MPs remain unclear. In this work, the adsorption characteristics of sulfonamides (SAs) on virgin MPs (thermoplastic polyurethanes (TPUs), polyamides (PAs)) and aged MPs were determined under simulated conditions (ultraviolet (UV), ultraviolet combined hydrogen peroxide (UV + H2O2)). Contrasting effects of MP aging on SA adsorption were observed. That is, the adsorption capacities of aged PAs were decreased from 14.45% to 58.53%, whereas those of aged TPUs were increased from 13.93% to 171.30%. To interpret this interesting phenomenon, the structural characteristics of the tested MPs were determined, and the results indicated that the surface structures of MPs changed with aging, which resulted in differences in hydrophobicity and surface charge and a significant difference in the concentrations of oxygen-containing functional groups (P < 0.05). Furthermore, density functional theory (DFT) results revealed that the equilibrium configurations and the interactions (H bond, electrostatic effect, van der Waals (vdW) forces were significantly influenced by the change in the concentration of oxygen-containing functional groups of MPs (P < 0.05), with the strength of H bonds increasing for aged TPUs-SAs and the strength of electrostatic interactions decreasing for aged PA-SAs. Our findings are the first to provide a theoretical basis for an improved understanding of the role of aging in SAs adsorption onto MPs.
ZHANG2022132963¡Bismuth-rich strategy intensifies the molecular oxygen activation and internal electrical field for the photocatalytic degradation of tetracycline hydrochloride¡BiOBr= BiOBr= Photocatalytic= Molecular oxygen activation¡Bismuth-rich photocatalyst (Bi3O4Br) and BiOBr were prepared by a simple hydrothermal method with different pH values. The increase in the atomic ratio of Bi/Br led to an upshift in the conduction band minimum and enhancement of hybridization. Therefore, molecular oxygen activation and the internal electrical field were strengthened by the rich bismuth strategy, and it resulted in better photocatalytic degradation and mineralization of tetracycline hydrochloride (TC). Trapping agent experiments and ESR results indicated that the degradation process was dominated by ·O2- while 1O2 was also a key factor. The upshift of CBM from −0.34 eV (BiOBr) to −0.43 eV (Bi3O4Br) accelerated the production of ·O2-. At the same time, the highly efficient separation of photogenerated electron-hole pairs could be attributed to the transformation of O2/·O2- and enhancement of hybridization, which were proven by photoelectrochemical measurement, PL and time-resolved PL spectra. The degradation pathway of TC dominated by ·O2- and 1O2 was also discussed.
CHEN2022132951¡Reduced graphene oxide-supported hollow Co3O4@N-doped porous carbon as peroxymonosulfate activator for sulfamethoxazole degradation¡Peroxymonosulfate= ROS contribution ratio= Degradation mechanism= Ecotoxicity¡A novel reduced graphene oxide-supported hollow Co3O4@N-doped porous carbon (Co3O4@NPC/rGO) composite was synthesized via self-assembly and pyrolysis-oxidation using bimetallic zeolite imidazolate frameworks and graphene oxide as precursors. The as-obtained composite exhibited superior performance on peroxymonosulfate (PMS) activation over a wide pH range. Complete removal of sulfamethoxazole (SMX, 25 mg·L−1) was achieved within 5 min and the reaction rate constant was higher than those of the most reported heterogeneous catalyst/PMS systems for SMX degradation. It was demonstrated that both radical pathways (SO4−, OH, and O2−) and non-radical pathways (1O2 and direct electron transfer) were involved in the SMX degradation. Significantly, the contribution ratio of each reactive oxidative species (ROS) in the bulk solution or on the catalyst surface was differentiated and calculated for the first time. SO4− both in the bulk solution and on the catalyst surface as well as the 1O2 in the bulk solution were the dominant ROS. The possible degradation mechanism of SMX by Co3O4@NPC/rGO/PMS system was proposed. Co active sites with high activity, the electron-rich ketonic group and the nitrogen doping sites within Co3O4@NPC/rGO contributed to the excellent catalytic activity. The ecotoxicity of SMX and its intermediates was investigated. Besides, the reusability, stability and application potential in actual waterbodies of Co3O4@NPC/rGO were evaluated. Overall, this work expands the environmental application of metal–organic frameworks (MOFs)-derived hollow nanomaterials and provides a promising heterogeneous catalyst for the elimination of refractory contaminants by sulfate radical-based advanced oxidation processes (SR-AOPs).
CHEN2022133024¡Interfacial synthesized covalent organic framework nanofiltration membranes for precisely ultrafast sieving¡Interfacial synthesis= Covalent organic frameworks= Composite membranes= Selective molecular sieving¡Covalent organic frameworks (COFs), a series of crystalline materials with ordered nanopores, are highly desirable for ultrafast and selective nanofiltration. However, COF-based membranes are typically synthesized via difficult synthetic procedures with long reaction time and show poor mechanical properties, which may hinder their widespread applications. Herein, a facile interfacial method is developed to synthesize COF membranes via the synergistic effect of interfacial diffusion and in-phase Brownian motion. Continuous free-standing COF films with a thickness of 111 nm are obtained within only 3 h under mild reaction conditions. Meanwhile, this synthesis method is suitable for the fabrication of COF membranes with a thin-film-composite (TFC) structure, enabling obtained COF membranes good mechanical properties under external forces and practical nanofiltration tests. Compared with other reported nanofiltration membranes, TFC-COFs exhibit state-of-the-art water permeance (173.94 L m2 h−1 bar−1) and superior rejections exceeding 98.50% to dyes larger than 1.3 nm. Precisely selective sieving of obtained TFC-COFs is systematically studied by separating diverse mixed dye solutions. Furthermore, monomers used in this method can be replaced, creating COF-based membranes with customizable functionality to enable a broad range of selective separations.
LI2022132979¡CO2 capture and activation with a plasma-sorbent system¡CO2 capture= Plasma system= CO2 conversion= Sorbents¡Non-thermal plasma-induced one-step desorption of splitting of CO2 has been investigated in this research for carbon capture and utilization. An experimental study was conducted in a plasma-sorbent system that consists of a coaxial DBD reactor packed with hydrotalcite pellets. Operation parameters including discharge power and carrier gas flow rate were varied to explore their effect on the desorption of CO2 from the sorbent and conversion to CO. Results showed that the discharge power plays the dominant role in the desorption process. Faster desorption was achieved with increasing power but at a cost of CO2 conversion. Although the carrier gas flow rate does not have a significant effect on the desorption, higher conversion was achieved with a higher flow rate due to the dilution effect. The maximum single pass conversion of CO2 achieved was 67.44%. Based on the feature of this technology, periodic operation of multiple reactors including reactors in parallel and in series are discussed for continuous CO2 capture and its full conversion.
CAO2022133043¡High-rate long-lasting solar desalination towards hypersaline brine enabled by introducing a siphon-drop mode¡Direct solar steam generation= Siphon-drop mode= Top-down active water diffusion= Strong brine¡Direct solar steam generation (DSSG) is well-proven to be a sustainable and effective technique to provide high-quality freshwater supply. However, it customarily suffers from severe salt accumulation, especially for treating strong brine, becoming a fatal bottleneck for approaching its commercial applications. Herein, we developed a DSSG with potent siphon-drop mode to achieve powerful self-absorbing and self-desalting, in which the 3D cone-shaped self-supporting polydopamine and polyethyleneimine co-coated poly(acrylonitrile-styrene-acrylate) (PDA-PEI@ASA) used as photothermal material (PTM). Source water can be spontaneously and continuously pumped to the top of water-evaporating surface of PTM via strong siphon effect, and the top-down active water diffusion on evaporating surface can effectively take the salts away from the system. Such above features give the DSSG real-time antifouling nature and hence address the fatal issue of salt accumulation. Accordingly, when continuously treating a near-saturated brine (20% NaCl) for at least 168 h, no obvious salts deposition can be found with a steady water evaporation rate of ∼2.550 kg m–2 h−1. This work could help shed novel light on the design of practical DSSG systems toward efficient lasting freshwater extraction, holding great promise for global water scarcity.
LI2022131996¡Enhanced performance of anaerobic two-phase reactor treating coal gasification wastewater with the assistance of zero valent iron under co-digestion conditions¡Coal gasification wastewater= Refractory pollutants= Anaerobic two-phase reactor= Zero-valent iron¡Coal gasification wastewater (CGW) is a typical industrial wastewater that is difficult to degrade as it contains a large number of refractory and toxic pollutants, such as high concentrations of phenols.The aim of this study is to investigate an anaerobic two-phase reactor treating synthetic CGW under co-digestion conditions. The optimum dosages of co-substrate (glucose = 1000 mg/L), zero valent iron (ZVI) (2 g/L), and hydrolysis acidification time (12 h) were explored by batch tests. The results indicated that the concentration of total phenols declined from 636 mg/L to 376 mg/L when the cumulative methane production increased to 145 mL. In the long-term operation of the anaerobic two-phase reactor, 1,000 mg/L glucose was added to the influent, and 2 g/L ZVI was added in the methanogenic phase, respectively. HRTs in acidogenic and methanogenic phases were kept at 12 h and 48 h, respectively. The average acetate and TVFAs concentrations remained at approximately 852 mg/L and 1042 mg/L, respectively. The result showed that the concentrations of influent and effluent COD were approximately 3,191 mg/L and 412 mg/L, respectively, while those of influent and effluent total phenols were approximately 655 mg/L and 23 mg/L, respectively. The removal efficiencies of total COD and total phenols were over 86% and 96%, respectively. In addition, the total methane production rose to 250 mL/d. Microbial community structure analysis demonstrated that the acidogenic phase contained most types of microbial species and the most complex community diversity in the anaerobic system and that direct interspecies electron transfer (DIET) might occur between the potential electroactive bacteria Chloroflexi and the archaea Methanobacteriales and Methanosaeta, respectively.
FIJOL2022132964¡3D-printable biopolymer-based materials for water treatment: A review¡3D printing= Biopolymers= Water treatment= Metal removal= Oil separation¡The global environmental concerns drive scientists all over the world to develop eco-friendly and sustainable alternatives to techniques and materials commonly used until now for water treatment applications. The relatively novel Additive manufacturing (AM) technology allows to process materials in a custom optimized, cost and time effective manner, while use of biobased materials minimizes the secondary pollution issue. Combining three-dimensional (3D) printing technology and biopolymer-based materials refines the water treatment industry, as it provides tailored water filtration systems easily available in the disadvantaged areas at low environmental impact and cost due to the raw materials’ bio-origin and abundance. This review highlights the combination of various 3D printing techniques such as Fused deposition modelling (FDM), Direct ink wetting (DIW) and Stereolitography (SLA) with nature-derived biopolymers and biopolymer-based materials including chitosan, Polylactic acid (PLA), alginate and Cellulose acetate (CA) for their potential application within the water treatment industry with emphasis on oil separation and metal removal. Moreover, the environmental impact of the revised biopolymers is briefly discussed.
LIU2022132990¡Tailoring oxygenated groups of monolithic cobalt-nitrogen-carbon frameworks for highly efficient hydrogen peroxide production in acidic media¡Oxygen reduction reaction= Hydrogen peroxide= Electrocatalysis= Selectivity¡Electrochemical synthesis has emerged as a promising alternative method for industrial production of hydrogen peroxide (H2O2). Although transition metal-nitrogen-carbon moieties have been regarded as efficient catalysts for oxygen reduction reaction (ORR), they are generally established for four-electron (4e−) pathway, rather than two-electron (2e−) one for selective generation of H2O2. Herein, we propose a strategy to achieve cobalt-carbon hybrids with high 2e− selectivity for H2O2 production in acidic media via tailoring their surface structure and coordination environment. The correlation between 2e− ORR selectivity of the fabricated monolithic electrodes, i.e. Co nanoparticles embedded in N-doped oxo carbon framework (CoNCF), and their oxygen-containing functional groups is revealed. In particular, an excellent H2O2 selectivity over 91 % in 0.05 M H2SO4 is achieved, which exceeds most of previously reported 2e− ORR electrocatalysts. Moreover, a sterilization system for water disinfection is constructed, demonstrating potential practical applications. The smart design of multi-active sites and porous monolithic architecture opens a new avenue for preparing advanced electrode for H2O2 generation and other environment/energy-related systems.
ZHOU2022133035¡Tuning selectivity of electrochemical reduction reaction of CO2 by atomically dispersed Pt into SnO2 nanoparticles¡CO reduction= SnO= atomically dispersed Pt= HCOO¡Electrochemical reduction of CO2 into fuels offers an attractive approach to environmental and energy sustainability. Herein, we designed atomically dispersed Pt into SnO2 catalyst (Pt atom/SnO2). Such catalyst dramatically improves the adsorption performance of CO2 and lowers the activation energy of CO2. DFT calculations indicate that the doping of Pt in SnO2 could induce charge redistribution and tune active electronic state, showing higher adsorption energy for intermediates CO2*, HCOO* and HCOOH*, which is different from the Pt NPs loaded SnO2 mainly for H2 generation. As a result, a higher Faradaic efficiency (82.1 ± 1.4%) and the production rate (5105 μmol h−1 cm−2) of HCOO– are achieved at −1.2 V vs. RHE. Moreover, the current density and Faradaic efficiency of HCOO– nearly remain unchanged in 8 h on the Pt atom/SnO2, indicating its high stability. This work opens up a new avenue to tune product selectivity by atomically dispersed catalysts.
ZHAO2022132961¡Mechanism of β-cypermethrin metabolism by Bacillus cereus GW-01¡Beta-cypermethrin= Biodegradation= Oxidative stress= Multi-omics analysis= Mechanism¡Pesticide residues in soil and food are of concern for human health. Biodegradation is an attractive option for reducing these residues, but more insight into the mechanism of degradation is necessary to ensure that toxic deadend products are not produced in the process. In this study, a β-cypermethrin (β-CY) degrading bacterium which we named GW-01 was isolated from a sheep’s rumen chyme. HPLC analyses of culture extracts revealed that train GW-01 degraded ∼ 60 % of 100 mg/L β‑CY within 7 d. Strain GW-01 transiently accumulated 3-phenoxybenzoic acid (3-PBA), phenol, and benzoic acid during β-CY degradation. Genomic, transcriptomic, and proteomic analyses of GW-01 during degradation of β-CY and its metabolites provided evidence that an α/β- hydrolase and a cytochrome aa3 quinol oxidase were responsible for the degradation of β-CY and 3-PBA, respectively. Chlorohydrolase was implicated in the degradation of phenol to catechol. Transcriptional and proteomic evidence was also found for upregulation of the benzoic acid degradation pathway and meta-pathway (catechol-2,3-dioxygenase), respectively. Based on these results a pathway for β-CY degradation is propose that provides greater insight into the mechanism of pyrethroid degradation by microorganisms.
KUMAR2022132966¡Electrochemical sensors for the detection of SARS-CoV-2 virus¡SARS-CoV-2= Electrochemical sensor= COVID-19¡Coronavirus (COVID-19), a deadly pandemic has spread worldwide and created many global health issues. Though methods of its detection are being continuously developed for the early detection and monitoring of COVID-19, still there is need for more novel methods. The presently used methods include rapid antigen tests, serological surveys, reverse transcription-polymerase chain reaction (RT-PCR), artificial intelligence-based techniques, and assays based on sensors/biosensors. Of all these, RT-PCR test has high sensitivity and specificity though it requires more time for testing and need for skilled technicians. Recently, electrochemical sensors have been developed for rapid monitoring and detection of SARS-CoV-2 from the patient’s biological fluid samples. This review covers the recently developed electrochemical sensors that are focused on the detection of viral nucleic acid, immunoglobulin, antigen, and the entire viral particles. In addition, we also compare and assess their detection limits, sensitivities and specificities for the identification and monitoring of COVID-19. Furthermore, this review will address the best practices for the development of electrochemical sensors such as electrode fouling, limit of detection/limit of quantification determination and verification.
