FARAG2022103647¡A human factors approach to evaluate predicators of acute care nurse occupational fatigue¡Occupational fatigue= Nurses= Shift-work¡Nurses function at the point of care and assume a significant role in intercepting errors. They work in a mentally and physically demanding profession that is comprised of shift-work, subjecting nurses to considerable fatigue. Yet, few studies constructed a comprehensive model that integrates personal and occupational factors to explore their relationship with various types of fatigue (acute, chronic, physical, mental, and total). Here, we examine this type of comprehensive fatigue-model, in a report that represents one aim of a larger, mixed-methods study. The study sample comprised of 1137 registered nurses working in eight hospitals in a Midwestern state. Nurses reported higher levels of acute and total fatigue than chronic and physical fatigue. Staffing and resource adequacy, exercise, and sleep were among the strongest predictors. Since fatigue is a multi-faceted construct, a comprehensive fatigue-management strategy that targets both day and night-shift nurses is the optimal way to manage nurse fatigue.
JUNG2022103649¡Usability enhancement based on usability heuristics: An examination of the underlying mechanism utilizing the psychological–refractory–period paradigm¡Usability heuristics= Interface design= User–interface (UI) design= Psychological–refractory–period paradigm¡User Interface (UI) design practices often abide by popular usability heuristics such as Nielsen’s (1994) “10 usability heuristics for user interface design” or Gerhardt–Powals' (1996) cognitive engineering principles. To examine the underlying mechanism of user performance enhancement by following some of these usability heuristics, we compared user performance between two device conditions: one representing design practices following two selected sets of usability heuristics (experimental condition) and the other without following them (control condition). As a research framework, we adopted the psychological–refractory–period (PRP) paradigm along with the locus–of–slack logic, a well–established dual–task paradigm for examining the nature of cognitive benefits caused by experimental manipulations. Results showed that the experimental–device condition that followed the usability heuristics yielded faster performance than the control condition, especially when the stimulus–onset–asynchrony between the two tasks was long than when it was short. According to the locus–of–slack logic, these results suggest that the nature of cognitive benefits caused by following the usability heuristics is more likely to be due to shortening of the response–activation stage (rather than the response–selection stage). These findings suggest that following the two usability heuristics tends to facilitate a specific stage of the information processes more than other stages.
ELPRAMA2022103615¡An industrial exoskeleton user acceptance framework based on a literature review of empirical studies¡Acceptance= Industrial exoskeletons= Use= Usage= Comfort= Technology acceptance= Discomfort¡1 Abstract Studying the acceptance of exoskeletons in industry has gained increased attention. Exoskeletons (wearable support devices) are envisioned to alleviate heavy work. Examining what factors influence the use of exoskeletons is important, because influencing these factors could positively contribute to the adoption of industrial exoskeletons. The factors identified in this paper have been systematically derived from empirical research with (potential future) end users, most of whom have tried on an exoskeleton. Our framework with factors influencing the acceptance of industrial exoskeletons can be used during the (ideally iterative) design, (re)development and evaluation phase of new or existing exoskeletons. This could improve the quality of exoskeletons since this allows designers to already consider acceptance factors early in the design process instead of finding out what is important late in the design process during (field) testing. In turn, this might accelerate the adoption of exoskeletons. Also, our framework can be used to study the ongoing introduction of exoskeletons at work since it also addresses policy decisions companies interested in implementing exoskeletons should consider.
OAKMAN2022103614¡Workplace physical and psychosocial hazards: A systematic review of evidence informed hazard identification tools¡Hazards= Risk assessment= Musculoskeletal disorders= Ergonomics¡Prevention of musculoskeletal disorders (MSDs) requires the identification of physical and psychosocial hazards. This systematic review aimed to identify accessible and validated tools, for the assessment of workplace physical and psychosocial hazards, and consolidate the results into a matrix for use by work health and safety (WHS) professionals. Web of Science, Medline, ProQuest Central, and PsychInfo electronic databases, along with grey literature, were searched (Jan 1990 to July 2020). Studies that included tools with evidence of validity for the identification of physical hazards, psychosocial hazards, or both were included. A total of 83 tools were identified and then reviewed to ensure the tools were accessible. The final matrix included a total of 26 tools (16 physical, 4 psychosocial, and 6 comprehensive [physical and psychosocial]). Evidence on best practice for MSD mitigation supports the need for a comprehensive approach; however, the current review identified limitations in the availability of such tools to support WHS professionals.
TETTEH2022103646¡Effects of passive exoskeleton support on EMG measures of the neck, shoulder and trunk muscles while holding simulated surgical postures and performing a simulated surgical procedure¡sEMG= Musculoskeletal disorders¡Exoskeletons have shown significant impact at reducing the biomechanical demand on muscles during repetitive lifting and overhead tasks in non-healthcare industries. However, the benefits of exoskeletons are yet to be realized in the operating room, particularly as work-related musculoskeletal disorders continue to be a concern for surgeons. This study quantified the effect of using neck, arm, and trunk exoskeletons on muscle activity while assuming typical postures held in the operating room. Fourteen participants were recruited to participate in this study. In this two-part experiment participants were asked to 1) hold a series of neck flexion, arm abduction and trunk flexion postures seen in surgical procedures, and 2) perform a simulated surgical task requiring five different trunk flexion posture levels. Participants were required to complete these tasks with and without passive exoskeleton(s). This study showed that even for postures held short time periods, exoskeletons are beneficial at reducing the demand on muscles; however, the reduction in muscle demand depends on body segment and postural angle, as intended with these passive exoskeletons. Furthermore, for the simulated surgical task with awkward trunk flexion postures (10–65°), the trunk exoskeletons showed a significant reduction in the rate of rise in back muscle sEMG (+1.365%MVC/min vs. +0.769%MVC/min for non-dominant lumbar extensor muscles, p = 0.0108; +1.377%MVC/min vs. +0.770%MVC/min for the dominant lumbar extensor muscles, p = 0.0196) over 25 min, consequently resulting in improved trunk subjective discomfort scores (7.34 vs. 4.30, p < 0.05), with no impact on the neck and shoulder biomechanical demand. The results from this study indicate that exoskeletons may be a potential intervention to reduce biomechanical loading during surgery.
WINBERG2022103661¡Anti-fatigue mats can reduce low back discomfort in transient pain developers¡Anti-fatigue mats= Low back pain¡Complaints of musculoskeletal pain are common among employees who stand for prolonged periods. This study sought to determine if an anti-fatigue mat (AFM) could uniquely affect low back pain (LBP), low back posture, and foot-floor interface responses in individuals prone to developing LBP (termed pain developers (PDs)) during prolonged standing experiments compared to those who do not develop LBP under the same exposures (termed non pain developers (NPDs)). Sixteen volunteers (8 PDs and 8 NPDs) were recruited based on their pain-development tendencies, which were established in previous standing experiments. They visited the laboratory on two separate days for 60 min of light manual work while standing on either a rigid floor or AFM. All participants were asymptomatic at the beginning of each experimental session. The amount of LBP experienced during the standing exposure, measured via a visual analogue scale, was reduced (p = 0.03) in the PD group when on the AFM (3.6 ± 6 mm) compared to the rigid floor (6.8 ± 7 mm). LBP levels remained low and unchanged (p = 0.5) between the AFM (2.4 ± 5 mm) and rigid floor (1.6 ± 2 mm) conditions for the NPD group. Neither postural nor foot-floor interface measures correlated with this unique reduction of LBP for the PD group when standing on the AFM. The AFM did, however, increase centre of pressure excursion (NPD 55% increase; PD 35% increase) and tended to increase the number of body weight shifts (NPD 116% increase; PD 54% increase) in both the PD and NPD groups. These findings suggest that AFMs may selectively benefit individuals prone to developing standing-induced back pain by facilitating subtle movements at the foot-floor interface.
MCLEAN2022103651¡Evaluation of a systems ergonomics-based incident reporting system¡RE-AIM= Led outdoor activity= Incident reporting= Systems analysis¡Introduction Incident reporting and learning systems are a fundamental component of safety management. The purpose of this study was to evaluate a novel incident reporting system specific to the Australian Led Outdoor Activity (LOA) sector. The Understanding and Preventing Led Outdoor Accidents Data System (UPLOADS), is a recently introduced systems thinking-based incident reporting and learning system that utilises contemporary safety theory and methods. Method The implementation of UPLOADS was evaluated using the RE-AIM framework based on the following dimensions: Reach, Efficacy, Adoption, Implementation, and Maintenance. A pragmatic evaluation approach was used in which evaluation data were collected through the triangulation of multiple sources including different LOA stakeholders from both the individual organisational level (LOA providers) and LOA sector governance level (LOA industry representatives), incident data collected through the UPLOADS National Incident Dataset, and the online and physical presence of UPLOADS. Results The findings show that a key strength of UPLOADS is its effectiveness as incident reporting tool for improving safety in the LOA sector. However, a weakness of UPLOADS is that it is not being implemented appropriately by the LOA providers. Conclusion Overall, the current findings suggest that UPLOADS incident reporting tool is perceived by SMEs as an effective tool for improving safety in LOA. However, further work is required for UPLOADS to have a greater impact on the LOA sector. Specifically, Implementation of the UPLOADS system requires improvement, as well as additional training and education may be required to upskill and empower LOA providers to improve reporting and enhance the value placed on safety by LOA stakeholders. The RE-AIM framework was an appropriate evaluation framework for understanding the effectiveness of UPLOADS as a LOA sector specific incident reporting and learning system. Practical applications The current findings have practical implications for ergonomics researchers applying evaluation frameworks in the real world, and LOA providers for implementing safety interventions. Lastly, contemporary systems-based incident reporting and learning systems have the capability to enhance the safety practices of the LOA sector.
HAMIM2022103650¡Taking a mixed-methods approach to collision investigation: AcciMap, STAMP-CAST and PCM¡Accimap= STAMP-CAST¡Recently, ergonomics and safety researchers have turned their attention towards applying combinations of sociotechnical methods rather than using single methods in isolation. In the current research, a mixed-method approach combining two systems-based methods, Accimaps and the Systems Theoretic Accident Model and Process - Causal Analysis using Systems Theory (STAMP-CAST), and one cognitive approach, the Perceptual Cycle Model (PCM), were employed in analysing a rail-level crossing incident in Bangladesh. Each method was applied individually to investigate the collision, and interventions were proposed corresponding to incident events at different risk management framework levels. The three methods provided different perspectives of the whole picture, together identifying an array of contributory factors. The complementary nature of these methods aided in proposing a comprehensive set of safety recommendations, thereby demonstrating the benefit of a mixed-method approach for collision investigation in low-income settings.
LI2022133013¡Boosting low-temperature water gas shift reaction over Au/TiO2 nanocatalyst activated by oxygen plasma¡Plasma treatment= Au nanocatalysts= WGS reaction¡The efficient removal of carbon monoxide (CO) from H2-rich stream via the water gas shift (WGS) reaction requires the catalysts that possess high activity at low temperatures to avoid the thermodynamic equilibrium limitation. We report that oxygen (O2) plasma activation enables an Au/TiO2 nanocatalyst to achieve superior activity in the WGS reaction at low temperatures. At 120 °C, O2 plasma activated Au/TiO2 nanocatalyst exhibits CO reaction rate of 0.51 mmol·mg−1·h−1, which is 5 times higher than the conventional activated counterpart. CO conversion over O2 plasma activated Au/TiO2 nanocatalyst only slightly decreases from 73% to 68% during a 4.5 h continuous WGS reaction at 150 °C. The catalyst characterizations indicate that O2 plasma activation could control average size of Au nanoparticles below 3.5 nm, create plenty of coordinatively unsaturated sites (on Au nanoparticles) and sufficient Auδ+-Oδ--Ti sites (at interfaces between Au and TiO2), and modulate the electronic structure of interfaces, which accelerates greatly the WGS reaction. Further, the enhancement mechanism of the WGS reaction over O2 plasma activated Au/TiO2 nanocatalyst was disclosed.
JING2022133034¡Regulation of electron depletion layer in polymer-based nanocomposites for superior energy storage capability¡Breakdown strength= Electron depletion layer= Heterojunction region= Energy storage¡Polymer-based dielectrics trigger great interests in advanced electric systems due to their high breakdown strength and power density. However, a major drawback is that excessive addition of high-εr ceramic nanofillers may deteriorate their breakdown strength and further reduce energy density. Herein, a general strategy is provided to dramatically enhance the breakdown strength by introducing a small amount of core–shell structured Al2O3@BiFeO3 nanofibers into PVDF/PMMA polymer matrix. The thickness of BiFeO3 shell is regulated by controlling its molar concentration. A significantly enhanced breakdown strength (759 kV mm−1) and an ultrahigh energy density (22.7 J cm−3) with an energy efficiency of 72% are observed. The greatly improved breakdown strength is ascribed to the regulation of electron depletion layer. When the width of heterojunction region gradually approaches to the scale of electron depletion layer, more annihilation of electrons happens and thus contributes to the enhancement of the breakdown strength. The results suggest that our designed structure can help to address the issue of both enhancing the breakdown strength and energy density for diverse nanocomposites over a broad application.
MA2022132989¡Lightweight, elastic and superhydrophobic multifunctional nanofibrous aerogel for self-cleaning, oil/water separation and pressure sensing¡Conductive= Superhydrophobic nanofibrous aerogel= Self-cleaning= Oil/water separation¡Developing a durable, lightweight, and robust aerogel with multifunctional characteristics is greatly desirable but remains challenging these days. Herein, an environment-friendly and original nanofibrous aerogel with integrative performance was constructed through the combination of nanofibrous aerogels’ forming technique and post-treatment modification approach. The obtained aerogel has a hierarchical porous structure consisting of flexible polyacrylonitrile nanofibers (PANF), a functional polyvinyl alcohol (PVA) polymer, conductive carbon nanotubes (CNTs), and hydrophobic octadecylamine functionalized reduced graphene oxide (ODA-rGO), endowing it with ultralow density (20.54 mg cm−3), superior compressibility and recoverability, outstanding fatigue resistance over 1000 cycles. The hydrophobic ODA-rGO coating imparts the hydrophilic PANF/CNT aerogel superhydrophobicity (154°), contributing to a splendid self-cleaning ability. Additionally, the aerogel was capable of realizing excellent oil/water separation performances. Both organic solvents and soybean oil could be adsorbed by the aerogel with high adsorption capacity (36.07 to 65.09 g g−1) and good stable in recycling as a result of its hierarchical porous structure and good hydrophobicity. It was noteworthy that the aerogel composite can be used as a piezoresistive sensor, exhibiting high sensitivity (33 kPa−1 in the range of 0–2 kPa), low detection limit (1% strain), fast response (160 ms), and good durability (over 1000 cycles). Further, it was demonstrated that the composite can be used to monitor various human activities in real time. These advantages make it an excellent candidate for smart garments, high-efficient oil/water separation and human motion detection.
REN2022132977¡Optimized orbital occupancy of transition metal in spinel Ni-Co oxides with heteroatom doping for Aprotic Li-O2 battery¡Li-O battery= Oxygen electrode= Electrocatalyst= Ni-Co oxide¡Li-O2 battery is one of the most attractive energy storage technologies because of its extremely high energy density (3500 Wh kg−1). However, the main limitation of the battery is the high energy barrier during the formation and decomposition of the discharge product (Li2O2), which results in a series of problems such as large overpotential and poor cycle stability. Herein, the Fe-doped spinel Ni-Co oxides are employed as the cathode catalyst to decrease the energy barrier of the oxygen electrode reactions in Li-O2 battery. The batteries with Fe-doped Ni-Co oxides deliver a large discharge specific capacity of 16,727 mAh g−1 and remarkable durability of over 790 h at current density of 500 mA g−1. Based on the density functional theory (DFT) calculation, the optimized performance is attributed to the near-unity eg electron occupancy (1.32) in transition metal atom for iron-doped Ni-Co oxide as compared to that for undoped Ni-Co oxide (1.64). The near-unity eg electron occupancy can increase the covalency of transition metal-oxygen bonds and finally enhance the electrocatalytic activity. This study is helpful for deeply understanding the relationship between the surface electronic structure and catalytic activity of oxygen electrocatalysts in Li-O2 cells.
CHEN2022133005¡Pruney fingers-inspired highly stretchable and sensitive piezoresistive fibers with isotropic wrinkles and robust interfaces¡Pruney fibers=  polymerization= Isotropic wrinkles= Robust interfaces¡Scalable construction of robust and isotropic wrinkles on fiber surface is crucial for the development of highly sensitive piezoresistive fibers, which still remains a challenge. Herein, inspired by the typical morphology and formation of pruney fingers, we develop a novel core–shell “pruney fiber” with both isotropic wrinkles and robust interfaces via a scalable and facile fabrication strategy. Briefly, the robust isotropic wrinkles are constructed through the core thermoplastic polyurethane (TPU) molecular chain’s constriction and the sheath pyrrole monomer’ synergistic interfacial polymerization. As a result, the robust interfaces enable the pruney fiber high stabilities under a remark stretchability (200%). Two as-prepared pruney fibers are overlapped vertically for piezoresistive sensing. Owe to the interlocking of the surface isotropic wrinkles, the piezoresistive fibers show high sensitivity (0.15 kPa−1), fast response time (47 ms), low detection limit (0.2 g), and high stability. For practical applications, the piezoresistive fibers can be easily weaved and integrated into a smart glove for wearable sensors and human–machine interfaces (HMI). At last, the novel structure and its unique scalable developing process would pave a new way in stable surface structure engineering on variable surface in the future.
GAO2022132949¡Superstructure silver micro-tube composites for ultrahigh electromagnetic wave shielding¡Electromagnetic interference shielding= Electroless plating= Silver micro-tubes= Silver nanoparticle= Poly(lactic acid)¡Absorption-dominant electromagnetic shielding materials can effectively reduce secondary pollution in the shielding process, and have greater significance in practical applications. Herein, silver (Ag) micro-tubes with superstructure, which were fabricated via using poly(lactic acid) (PLA) fibers as templates, were used to achieve the composites with ultrahigh, lightweight, and absorption-dominant electromagnetic shielding performance. The Ag nanoparticles were firstly deposited on the surface of PLA fibers by chemical reduction. The Ag micro-tubes were obtained by etching the PLA fibers in the core. The Ag nanoparticles were stuck together to form the Ag micro-tubes by polymer chains. The ultrahigh electromagnetic interference (EMI) shielding effectiveness (SE) of ∼110 dB was found in the Ag micro-tubes composed with polydimethylsiloxane or PLA with 1.5 mm in thickness. Due to the micro-tube structure, the composites containing with Ag micro-tubes exhibited absorption dominant shielding mechanism and low density. The absorption coefficient (A) value could reach 0.79 in the composites with Ag micro-tubes. The ultrahigh EMI SE performance and absorption dominant shielding mechanism of the composites was ascribed to the superstructure of the Ag micro-tubes which could efficiently create surface plasmon resonance, electronic vibration, interfacial polarization, capacitance effect and conductive loss. The work provides a new idea for preparing ultrahigh electromagnetic shielding materials with high absorption and low density.
TANG2022132973¡Microstructure design and construction of anti-wetting and anti-fouling multifunctional Janus membrane for robust membrane distillation¡Membrane distillation= Janus membrane= Membrane structure= Electrospray= Anti-fouling¡Membrane wetting and fouling were main restrictions for the industrial application of membrane distillation (MD), especially in the presence of surfactants or oily substances. Herein, a novel anti-wetting and anti-fouling multifunctional Janus membrane was designed by optimization of the size of reentrant structure and position of hydrophilic layer. The theoretical relationships between wettability and the microstructure of the Janus membrane was derived mathematically. A facile approach was applied for the dual-layer bioinspired membrane fabrication by a two-step electrospray strategy. The resultant composite structure presented high omniphobicity (water contact angle of omniphobic sub-surface was 159.3 ± 1.1°) and underwater superoleophobicity (underwater oil contact angle of hydrophilic top surface was 152.7 ± 0.5°). Meanwhile, the wettability of the fabricated Janus membrane kept robust in a broad pH range of 1–14. During continuous MD treatment for emulsified oily hypersaline solution, the Janus membrane exhibited stable permeate flux and salt rejection (around 100%). It was speculated that the hydration effect of hydrophilic top layer coupled with the cavitation and slip boundary effects of the reentrant structure might be the key reasons for the robust anti-wetting and anti-fouling performances. Significantly, this novel bioinspired Janus membrane was believed as a candidate for treating challenging wastewaters such as the shale oils produced-water, and also had high potential in paving the way for industrial application of MD.
