YU2022132914¡Novel nanofiltration membrane prepared by amphiphilic random copolymer nanoparticles packing for high-efficiency biomolecules separation¡Nanofiltration= Amphiphilic copolymer= Soap-free emulsion polymerization= Charge-based separation¡Nanofiltration (NF) as a promising candidate is widely used in charge-based separation of ampholytic biomolecules. Construction of strongly charged permeation channel of NF membrane is one of the key factors for this process. In this work, random amphiphilic copolymer (RACP) nanoparticles were first packed to prepare nanoscale permeation channel. The RACP emulsion was firstly prepared by soap-free emulsion polymerization between [2-(methacryloyloxy) ethyl] trimethyl ammonium chloride (DMC) and methyl methacrylate (MMA), and then directly depositing onto porous substrate to form nanochannel selective layer of NF membrane. The optimal NF membrane shows a relatively large pore structure (i.e., cut-off pore size is 1.43 nm) and high pure water permeance (PWP) of 13.3 L·m−2·h−1·bar−1. Moreover, it shows a desirable rejection of basic amino acids and biopeptides (i.e., ∼95%) and allows neutral or acidic ones with similar molecule weight to permeate through. This work provides an innovative and facile method directly from RACP emulsion to construct NF membrane via nanoparticle packing, which greatly simplifies the preparation procedure for NF membrane. In addition, this novel NF membrane also demonstrates great potential in charge-based separation of biomolecules.
TRIPATHI2022103303¡MTCD: Cataract detection via near infrared eye images¡Iris= Cataract= Biometrics= Classification= Deep learning¡Globally, cataract is a common eye disease and one of the leading causes of blindness and vision impairment. The traditional process of detecting cataracts involves eye examination using a slit-lamp microscope or ophthalmoscope by an ophthalmologist, who checks for clouding of the normally clear lens of the eye. The lack of resources and unavailability of a sufficient number of experts pose a burden to the healthcare system throughout the world, and researchers are exploring the use of AI solutions for assisting the experts. Inspired by the progress in iris recognition, in this research, we present a novel algorithm for cataract detection using near-infrared eye images. The NIR cameras, which are popularly used in iris recognition, are of relatively low cost and easy to operate compared to ophthalmoscope setup for data capture. However, such NIR images have not been explored for cataract detection. We present deep learning-based eye segmentation and multitask network classification networks for cataract detection using NIR images as input. The proposed segmentation algorithm efficiently and effectively detects non-ideal eye boundaries and is cost-effective, and the classification network yields very high classification performance on the cataract dataset.
YU2022103314¡HSGAN: Reducing mode collapse in GANs by the latent code distance of homogeneous samples¡Generative adversarial networks= Mode collapse¡In this paper, we propose HSGAN, a novel generative adversarial network (GAN) variant that plays an adversarial game on the distance between two homogeneous samples (HS) in the latent space. HSGAN alleviates the notorious problem of mode collapse by maintaining a certain distance between the latent code of the generated data. Moreover, HSGAN is directly trained on the encoder and the generator, thereby gaining the ability to conduct inference without introducing any other model complexity. We prove theoretically that the objective function is designed to minimize the f-divergence between the distributions of the generated data and the real data. Extensive experiments on a series of synthetic and real image benchmark datasets demonstrate that HSGAN generates diverse images while keeping high quality, and it generally outperforms other GANs that target at the mode collapse problem.
AN2022103295¡Deep structural information fusion for 3D object detection on LiDAR–camera system¡3D object detection= LiDAR–camera system¡3D object detection on LiDAR–camera system is a challenging task, for 3D LiDAR point and 2D RGB image have different data representation. In this paper, We consider that the geometrical consistency in the local 3D and 2D regions is helpful for the regression task in 3D object detection, and propose 3D–2D consistent feature. It is based on hand-crafted 3D and 2D descriptors, generates primary structure feature, and has stable performance in outdoor scenes. Considering that material feature can be used to distinguish different objects, material coefficients ratio (MCR) is proposed to generate primary semantic feature, benefiting the classification task in 3D object detection. It is based on Lambertian model. To take advantage of both 3D–2D consistent feature and MCR, we propose deep 3D–2D structural information fusion (SIF) for 3D object detection. It provides attentional structural voxel feature, used as the input of LiDAR voxel based 3D object detectors. SIF is a light, effective, and explainable module. In the outdoor 3D object detection dataset, extensive experiments demonstrate that SIF improves the performance for both LiDAR voxel based single stage and multi-stage 3D detectors.
LI2022103301¡Simultaneous multi-person tracking and activity recognition based on cohesive cluster search¡Group activity= Collective activity recognition= Pairwise interaction¡We present a bootstrapping framework to simultaneously improve multi-person tracking and activity recognition at individual, interaction and social group activity levels. The inference consists of identifying trajectories of all pedestrian actors, individual activities, pairwise interactions, and collective activities, given the observed pedestrian detections. Our method uses a graphical model to represent and solve the joint tracking and recognition problems via three stages: (i) activity-aware tracking, (ii) joint interaction recognition and occlusion recovery, and (iii) collective activity recognition. This full-stack problem induces great complexity in learning the representations for the sub-problems at each stage, and the complexity increases as with more stages in the system. Our solution is to make use of symbolic cues for inference at higher stages, inspired by the observations of cohesive clusters at different stages. This also avoids learning more ambiguous representations in the higher stages. High-order correlations among the visible and occluded individuals, pairwise interactions, groups, and activities are then solved using the cohesive cluster search within a Bayesian framework. Experiments on several benchmarks show the advantages of our approach over the existing methods.
GONTHIER2022103299¡Multiple instance learning on deep features for weakly supervised object detection with extreme domain shifts¡Deep learning= Convolutional neural networks= Weakly supervised object detection= Non-photographic images= Art analysis¡Weakly supervised object detection (WSOD) using only image-level annotations has attracted a growing attention over the past few years. Whereas such task is typically addressed with a domain-specific solution focused on natural images, we show that a simple multiple instance approach applied on pre-trained deep features yields excellent performances on non-photographic datasets, possibly including new classes. The approach does not include any fine-tuning or cross-domain learning and is therefore efficient and possibly applicable to arbitrary datasets and classes. We investigate several flavors of the proposed approach, some including multi-layers perceptron and polyhedral classifiers. Despite its simplicity, our method shows competitive results on a range of publicly available datasets, including paintings (People-Art, IconArt), watercolors, cliparts and comics and allows to quickly learn unseen visual categories.
LI2022116027¡One-shot neural architecture search for fault diagnosis using vibration signals¡Neural architecture search= Fault diagnosis= Vibration signals¡Machine learning method has been widely applied in industrial fault diagnosis, especially the deep learning method. In the field of industrial fault diagnosis, deep learning is mostly used to extract features of vibration signals to achieve end-to-end fault diagnosis systems. Due to the complexity and variety of actual industrial datasets, some deep learning models are designed to be complicated. However, designing neural network architectures requires rich professional knowledge, experience, and a large number of experiments, increasing the difficulty of developing deep learning models. Fortunately, Neural Architecture Search (NAS), a branch of Automated Machine Learning (AutoML), is developing rapidly. Given a search space, NAS can search for networks that perform better than manually designed. In this paper, a one-shot NAS method for fault diagnosis is proposed. The one-shot model is a supernet that contains all candidate networks in a given search space. The supernet is trained to evaluate the actual performance of candidate networks by measuring the difference between its output probability and the true labels. According to the prediction of supernet, the networks with excellent performance can be searched, using some common search methods such as random search or evolutionary algorithm. Finally, the searched network is trained by reusing the weights of the supernet. To evaluate the proposed method, two search spaces are designed, ResNet and Inception search spaces, to search on PHM 2009 Data Challenge gearbox dataset. The state-of-the-art results are obtained, and accuracies of searched ResNet-A and Inception-A are 84.11% and 83.81%, which are 3.29% and 10.88% higher than Reinforcement Learning based NAS.
CHRISTENSEN2022116156¡Principles for small-unit sUAS tactical deployment from a combat-simulating agent-based model analysis¡Military decision-making processes= Unmanned system tactics= Agent-based modeling¡Recent increases in the operational and information gathering capabilities of small unmanned aircraft systems (sUAS) have made their deployment with small units of infantry attractive. Determining the potential impacts of sUAS deployment on infantry combat effectiveness and effectively disseminating that information to decision-making warfighters is imperative. This work presents an analysis of data generated by a Monte-Carlo simulation of 137,000 unique simulations of a static-defense scenario wherein defending units deploy sUAS in an information, surveillance, and reconnaissance role to aid in detecting, tracking, and targeting attacking units with indirect fires. The relationships between the number of UAVs deployed, the patrol method for those UAVs, and 40 combat effectiveness metrics are explored using a correlation matrix and other graphical methods. A set of eight principles for effective sUAs deployment in the aforementioned scenario are distilled from the simulation data and presented for further testing and validation.
ZHANG2022116048¡Evaluation of a new dataset for visual detection of cervical precancerous lesions¡Cervical cancer detection= Dataset= Deep learning¡Automated visual evaluation (AVE) is an emerging method to detect and diagnose cervical precancerous lesions by imaging and analysis via a deep learning classifier. Challenges in AVE development come from not only the limited data available, but also a proper design of the learning protocol. The most analyzed dataset (PEG) is traced to a clinical trial at a single site, where all the images were captured in a well controlled environment. Recently, cervical images have been captured by a light-weight mobile solution where the screening images were collected from a wider user pool at many sites. This paper introduces a new data resource (EVA dataset), collected by providers using a mobile colposcope during their routine practice. Compared to PEG, EVA images contain higher levels of data variations and exhibits a different distribution over multiple image attributes including image sharpness, brightness and colorfulness. In order to evaluate the practical value of EVA dataset for cervical high-grade squamous intraepithelial lesions (SIL) diagnosis, we further present an analysis of how a deep learning based framework can be used with both datasets by evaluating three key technical components: (1) region-of-interest (ROI) detection, (2) data augmentation and (3) pre-trained deep learning model selection. Our results indicate that ROI detection and shallow deep learning models usually help the detection on both datasets. While most data augmentations are effective on the EVA dataset, the improvement is less pronounced on PEG. Overall, using a deep-learning based framework looks promising for high-grade SIL diagnosis but there is still large room for improvements, especially on the EVA dataset. The noted differences indicate that the EVA dataset presents more practical challenges for high-grade SIL diagnosis and AVE classifier development.
KONOVALENKO2022116208¡Generating decision support for alarm processing in cold supply chains using a hybrid k-NN algorithm¡k-nearest neighbors= Fuzzy set= Recommendation= Decision Support= Pharmaceutical supply chain¡Real-time temperature monitoring is necessary in cold pharmaceutical supply chains (SCs), where exposures to extreme temperatures can lead to product quality deterioration. Temperature alarms (TAs) triggered by the current rule-based systems still require lengthy examinations before a suitable corrective measure (CM) can be chosen. However, provision of additional information relevant to TAs can expedite the examination process. In the related areas of recommender systems and false alarm/anomaly detection, k-nearest neighbors (k-NN) algorithm has proven to be successful because of its interpretability and ease of use. However, in the context of TA processing, it may suffer from some inherent limitations (i.e., varying neighborhood radius, unreliable classifications in sparse and noisy regions, and blindness to natural class boundaries). To overcome these limitations, we propose a hybrid k-NN (Hk-NN) algorithm based on the principles of local similarity and neighborhood homogeneity. It incorporates a two-step voting procedure with an entropy-optimized k-NN radius, decision trees with k-constrained leaves, and nearest neighbor predictions. We investigate 16,525 comments by alarm personnel for TAs in a pharmaceutical SC and encode them in terms of deviation causes and CMs (target features). We use SC data on cargo location, SC phase, sensor role, and temperature characteristics as predictor features for TA similarity estimation. In eight experimental setups, Hk-NN consistently outperforms k-NN with an optimized k in terms of accuracy, balanced accuracy, macro-average precision, recall, and specificity. At the same time, Hk-NN refrains from predicting observations, for which k-NN’s accuracy is close to a random guess.
JACKSON2022116223¡Talk to The Ghost: The Storybox methodology for faster development of storytelling chatbots¡Chatbot= Intelligent interfaces= Storytelling= Response generation= Conversational agent¡This paper presents the Storybox Methodology which combines a novel framework for structuring knowledge and conversations around a story (D-PAF), with a live chatroom-based training approach that builds the conversation knowledge base via live chatroom interactions. Chatbots have achieved success as intelligent interfaces in education, health, sales and support, but their move towards mainstream adoption has been hindered by the large amount of development resources required, in terms of data collection, preparation, user testing and technical knowledge. The complexity of the development task often necessitates both a system author and a domain expert working effectively together, adding further complexity and risk. Overcoming these barriers could increase feasibility of chatbots in a range of expert contexts. In education, there are groups of learners who do not enjoy reading and writing. Storytelling chatbots might be able to introduce these groups to enjoyable new ways to read and write, having a beneficial impact on their education and future prospects. This paper proposes the Storybox Methodology for the rapid development of storytelling chatbots. Storybox is evaluated by creating, training and testing ‘The Ghost’, a chatbot enacting Hamlet's Ghost character from William Shakespeare's dramatic tragedy. The results showed that after a period of live chatbot training of only 25 training conversations, The Ghost was able to conduct convincing conversations with participants.
KARA2022116198¡The rise of ransomware: Forensic analysis for windows based ransomware attacks¡Cybersecurity= Digital forensic= Malware attacks= Ransomware detection= Onion ransomware¡While information technologies grow and propagate worldwide, malwares have modified and risen their efficiency towards information system. Recently, the attackers have started to use ransom software (ransomware) as an effective method of cyberattack because of their profitability. Ransomware infiltrate victim systems in various ways, usually encrypt files in the system, and demand a ransom to allow user access to the encrypted files again. Although security mechanisms such as firewalls, anti-virus programs, and automated analysis programs have been developed to combat this threat, these mechanisms have little success and fail to protect the valuable assets stored in local or cloud storage resources. In this study, an effective detection and analysis method against ransomware was proposed, and the proposed method was discussed in detail with a case study. As a result of the study, potential information about the attacker were found to be accessible through characteristic behavior analysis of the onion ransomware, which was analyzed in accordance with the proposed method. This paper also presents an insight to the ransomware threat and provides a basic review of the methods and techniques used in the detection and analysis of ransomware attacks.
AGARWAL2022116154¡Improvements in Multi-Document Abstractive Summarization using Multi Sentence Compression with Word Graph and Node Alignment¡Multi-document abstraction= Word Graph= Node alignment= Multi sentence compression¡The present work proposes a scheme for multi-document abstractive text summarization using node-aligned Word Graph based representation of clustered sentences. In the first step, the proposed scheme uses SBERT embedding for representing the sentences as fixed-size vectors. The sentences belonging to the same cluster are then represented using Word Graph, in which words of different sentences are aligned based on their semantic and syntactic similarities. The advantage of the above representation is that it utilizes alignment information of words between pairs of similar sentences to merge nodes in the Word Graph, and thereby facilitating the generation of sentences with multiple chunks of information. A sentence scoring function assisted by an intensification function is used to measure the grammaticality and informativeness of the generated sentences. Integer Linear Programming has been used to make the final selection of the scored sentences for generating the abstract. Experiments conducted for the task of sentence fusion and multi-document summarization demonstrate superior performance in comparison with the state-of-the-art techniques available in the literature.
MEI2022116165¡Relation-aware Heterogeneous Graph Transformer based drug repurposing¡Drug repurposing= Graph neural network= Graph transformer= Link prediction¡Drug repurposing refers to discovery of new medical instructions for existing chemical drugs, which has great pharmaceutical significance. Recently, large-scale biological datasets are increasingly available, and many graph neural network (GNN) based methods for drug repurposing have been developed. These methods often deem drug repurposing as a link prediction problem, which mines features of biological data to identify drug–disease associations (i.e., drug–disease links). Due to heterogeneity of data, we need to deeply explore heterogeneous information of biological network for drug repurposing. In this paper, we propose a Relation-aware Heterogeneous Graph Transformer (RHGT) model to capture heterogeneous information for drug repurposing. We first construct a drug–gene–disease interactive network-based on biological data, and then propose a three-level network embedding model, which learns network embeddings at fine-grained subtype-level, node-level and coarse-grained edge-level, respectively. The output of subtype-level is the input of node-level and edge-level, and the output of node-level is the input of edge level. We get edge embeddings at edge-level, which integrates edge type embeddings and node embeddings. We deem that in this way, characteristics of drug–gene–disease interactive network can be captured more comprehensively. Finally, we identify drug–disease associations (i.e., drug–disease links) based on the relationship between drug–gene edge embeddings and gene–disease edge embeddings. Experimental results show that our model performs better than other state-of-the-art graph neural network methods, which validates effectiveness of the proposed model.
JOKIC2022116203¡Semantic segmentation based stereo visual servoing of nonholonomic mobile robot in intelligent manufacturing environment¡Visual servoing= Semantic segmentation= Nonholonomic mobile robot= Image registration= Stereo camera system¡In the interest of developing an intelligent manufacturing environment with an agile, efficient, and optimally utilized transportation system, mobile robots need to achieve a certain level of autonomy as they play an important role in carrying out transportation tasks. Bearing this in mind, in the paper we propose a novel stereo visual servoing method for nonholonomic mobile robot control based on semantic segmentation. Semantic segmentation provides a rich body of information required for an adequate decision-making process in a clustered, dynamic, and ever-changing manufacturing environment. The innovative idea behind the new visual servoing system is to utilize semantic information of the scene for visual servoing, as well as for other mobile robot tasks, such as obstacle avoidance, scene understanding, and simultaneous localization and mapping. Semantic segmentation is carried out by exploiting fully convolutional neural networks. The new visual servoing algorithm utilizes an intensity-based image registration procedure, which results in the image transformation matrix. The transformation matrix encompasses the relations of images taken at the current and desired pose, and that information is directly used for visual servoing. The developed algorithm is deployed on our own developed wheeled differential drive mobile robot RAICO (Robot with Artificial Intelligence based COgnition). The experimental evaluation is carried out in the 3D simulation environment and in the laboratory model of the real manufacturing environment. The experimental results show that the accuracy of the proposed approach is improved when compared to the state-of-the-art approaches while being robust to the partial occlusions of the scene and illumination changes.
RADMAN2022115980¡Deep residual network for face sketch synthesis¡Face sketch synthesis= Deep learning= Residual learning¡Face sketch synthesis plays a crucial role in face recognition for law enforcement applications. However, the current face sketch synthesis approaches generate sketches from photos based on a model trained by a certain database that is usually collected from individuals of the same ethnicity, and therefore such sketches merely inherit distinct facial distributions (shape and texture) of this database. This also makes such models inapplicable for real-world applications which mainly include multiple photo variations such as pose, lighting, skin color, and ethnic origin. In this paper, a unified face sketch synthesis model considering ethnicity issue as well as photo variations is proposed. A new deep learning scheme is designed to handle the generic visual representation and global structure of the face. Towards the final objective, the recent success of deep residual blocks is exploited and incorporated into a plain feedforward network, termed as DResNet, to learn a regression model for face sketch synthesis. A heterogeneous database containing photos with lighting, ethnicity, hair and skin variations is utilized for training the DResNet model. Extensive subjective and objective evaluations showed the superiority of the proposed DResNet method on state-of-the-art face sketch synthesis methods. Experimental results also demonstrated that the proposed DResNet method can be generalized to face sketch synthesis for real-world applications.
