ZHANG2022132997¡Anisotropically conductive Mg(NO3)2·6H2O/g-C3N4-graphite sheet phase change material for enhanced photo-thermal storage¡Mg(NO)·6HO= g-CN= Graphite sheet= Anisotropic thermal conduction¡The use of phase change materials (PCMs) for solar thermal collection can solve the mismatch problem of energy supply and demand caused by intermittent solar radiation. Traditionally, photo-thermal storage performance has been limited by the low thermal conductivity of PCMs and the massive heat transfer loss between PCMs and their external environment. Herein, we demonstrate that embedding a highly oriented graphite sheet (GS) network in a PCM results in an anisotropic thermal conduction structure, endowing the material with rapid internal thermal conduction and reduced heat loss to the external environment, thereby enhancing photo-thermal storage performance. We imitate the structure of layer cake to create a multilayered composite phase change material (CPCM), Mg(NO3)2∙6H2O/g-C3N4-GS (MNH/CN-GS), which has a highly oriented anisotropic thermal conductivity. The through-plane and in-plane thermal conductivities of MNH/CN-GS reach 0.55 and 15.70 W/(m·K), respectively, at 40 wt% GS loading in the CN-GS matrix. This corresponds to a high anisotropic degree of thermal conduction of 28.56, which results in a high average photo-thermal storage efficiency of 88.4%. The photo-thermal storage efficiency remains above 80% even at a high temperature of approximately 94 ℃. The proposed anisotropic thermal conduction structure eliminates the trade-off between high photo-thermal conversion rate and high energy efficiency in solar thermal storage.
WANG2022133026¡Environmentally persistent free radicals in bismuth-based metal–organic layers derivatives: Photodegradation of pollutants and mechanism unravelling¡Environmentally persistent free radicals= Photocatalysis= Metal–organic frameworks¡Formation of environmentally persistent free radicals (EPFRs) on carbonaceous material has aroused increasing research attentions. In terms of metal organic frameworks (MOFs) derivatives, however, scarce studies have dedicated to the relevant aspects. Herein, EPFRs have been detected in Bi-metal organic layers (Bi-MOLs) derivatives. The corresponding g-factors and concentrations of EPFRs on Bi2O3@C by pyrolyzed at different temperatures were 2.0041–2.0046 and 7.04 × 1019-1.77 × 1020 spins/g, respectively. Interestingly, similar EPFRs signals were also monitored in HKUST-1 based and UiO-66 based derivatives. We observed that Bi2O3@C system with the highest EPFRs concentration exhibited superior degradation and mineralization efficiency for phenol and tetracycline. Its excellent photocatalytic performance was mainly attributed to the interaction between the internal EPFRs and photoinduced active species, which promoted more generation of reactive oxygen species (ROS) radicals. This hypothesis was supported by line correlations for EPFRs concentration vs. degradation kinetics in samples pyrolyzed at different temperatures (R2 = 0.946). Most significantly, mechanism investigation combined with DFT calculation indicated that the EPFRs not only promote the generation of 1O2 and •OH via molecular oxygen activation pathway but also provided a possibility of enhancing water oxidation by holes. These findings pave the way for MOFs derivative's implication and insight into the role of EPFRs in photocatalysis.
LI2022132969¡Hollow N-doped carbon nanoflowers with nanosheets subunits for electrocatalytic oxygen reduction¡Electrocatalysis= Oxygen reduction reaction= Self-template synthesis= Hollow carbon nanostructures¡The synthesis of economic carbon-based metal-free catalysts with high electroactivity for the oxygen reduction reaction (ORR) is still a huge challenge for energy storage and conversion devices. Herein, the hollow N-doped carbon nanoflowers (h-N-CFs) with nanosheets subunits were synthesized by using 3,5-diaminobenzoic acid-1,3,5-benzenetricarboxaldehyde (DABA-BTCO) complex nanoflowers as the self-template and nitrogen resource. Various physical characterizations show that h-N-CFs with hollow and porous architecture have a high surface area (1390.3 m2g−1) and abundant activated N atoms (i.e., graphitic N and pyridinic N). Electrochemical measurements demonstrate that h-N-CFs synthesized at 800 °C can be used as an efficient metal-free ORR catalyst with prominent electroactivity and stability due to hollow architecture, abundant pores, and high N-doping content. Meanwhile, h-N-CFs also show eminent ORR selectivity (i.e., methanol tolerance) in alkaline media, which markedly surpasses benchmark Pt/C catalyst in the presence of methanol.
WEI2022133021¡Multifunctional oxidized poly (arylene sulfide sulfone)/UiO-66 nanofibrous membrane with efficient adsorption/separation ability in harsh environment¡Nanofibrous membrane= Oxidized poly (arylene sulfide sulfone)= Corrosion resistance= Water–oil separation¡Wastewater compositions complexity has severely increased with the rapid industrialization process. In this work, a multifunctional oxidized poly (arylene sulfide sulfone)/UiO-66 (OPASS-U) nanofibrous membrane was successfully developed via electrospinning technology, which could simultaneously remove the multiple contaminants, such as emulsified oil, organic dyes, and heavy metal ions and exhibit outstanding stability in the corrosive and harsh environment. It is founded that the OPASS-U nanofibrous membrane had large specific surface area, hydrophobicity, and high flux. The OPASS-U nanofibrous membrane was demonstrated to remove oil from both oil/water and water-in-dichloromethane emulsion with high removal efficiency (98.44%) and flux (636 L/m2h). It also represented high adsorption amounts for methylene blue and Cr (VI) with opposite charges and large specific surface area. Meanwhile, the OPASS-U nanofibrous membrane could achieve 99.9% regeneration efficiency after ten cycles of methylene blue removal. More importantly, this membrane maintained an outstanding stable morphology and high removal performance for a variety of contaminants after storing in corrosive and harsh solution, which could be widely utilized in complex wastewater treatment especially under harsh environment.
YU2022132993¡Heterostructured Cu2S@ZnS/C composite with fast interfacial reaction kinetics for high-performance 3D-printed Sodium-Ion batteries¡Heterostructures= CuS@ZnS/C nanohybrid= Carbon decorating= 3D printed¡Construction of heterogeneous nanostructures for electrode materials has been considered as an efficient approach to improve the associated electrochemical performance, it is thus crucial to rationally design favorable heterostructures and engineer the interface of two phases. We herein report the elaborately design and fabrication of heterostructured nanohybrids with ZnS and carbon coating Cu2S nanoplates (Cu2S@ZnS/C). Such distinctive nanostructures develop the advance heterostructures with carbon decorating can remarkably accelerate electron transfer and ionic diffusion kinetics while guarantee the structural integrity upon sodium ion storage. With these merits, the Cu2S@ZnS/C nanohybrid exhibits outstanding electrochemical performance with a high reversible capacity of 352 mAh g−1 at 10 A g−1 and long cycle stability with 94.7% capacity retention after 1000 cycles. Electrochemical kinetic analysis and Density functional theory (DFT) calculations demonstrate the decreased ions diffusion energy barrier for expediting electrochemical kinetics. Of note, the proof-of-concept 3D printed sodium ion batteries have been set up by coupling the 3D printed Cu2S@ZnS/C anode with 3D printed Na3V2(PO4)3 cathode, which are capable of delivering high and stable capacity output.
CAI2022132957¡High strength, recyclable, anti-swelling and shape-memory hydrogels based on crystal microphase crosslinking and their application as flexible sensor¡High strength hydrogel= Crystal microphase crosslinking= Strain hardening= Recyclability= Anti-swelling= Shape memory hydrogel¡To develop high strength, anti-swelling, and sustainable hydrogels, acrylonitrile copolymer hydrogels are prepared based on the structural characteristics of microphase separation and physical crosslinking of thermoplastic elastomers. The hydrogel can be recycled and reprocessed into any desired shape and can withstand the maximum tensile stress of about 23 MPa, the maximum fracture energy is as high as 7592 J/m2. The hydrogels exhibit strain hardening behavior at low strain. In addition, the high strength can be maintained stably for more than 60 days in an aqueous environment and the hydrogel has pH-induced shape memory property. The hydrogel can be further strengthened by the introduction of zinc ions, and its toughness and elongation at break are greatly improved, which is mainly based on the dynamic balance between free zinc ions and conjunct zinc ions in the gel. In addition, the introduction of zinc ions also greatly improves the electrical conductivity of the gel. The strain sensor prepared by this gel has high sensitivity, good linear response, and stability, and is expected to be a promising candidate material for flexible electronic products and strain sensors.
WU2022133062¡Full-visible-spectrum lighting enabled by site-selective occupation in the high efficient and thermal stable (Rb, K)2CaPO4F: Eu2+ solid-solution phosphors¡Full-visible-spectrum= (Rb=K)CaPOF: Eu= Site-selective occupation¡Tuning the luminescent properties of phosphors by crystal-site engineering is a good and efficient strategy for developing high-quality white light-emitting diodes (WLEDs). However, it is still challenging to modulate the cyan to red spectral emission in a single matrix and activator phosphor to obtain multicolor output and achieve full-visible-spectrum lighting. Herein, the strategy to manipulate site-selective occupation of Eu2+ activators by substituting the cation Rb+ with K+ is reported to obtain a versatile color output. The large-scale redshift regulation of emission spectrum from cyan to red was achieved in fluor-phosphate Rb2-yKyCaPO4F: 0.0085Eu2+ (R2-yKyCPOF: 0.0085Eu2+) (0 ≤ y ≤ 1.8) phosphors, which is designed by using Rb2CaPO4F: 0.0085Eu2+ (RCPOF: 0.0085Eu2+) cyan-emitting phosphor. The redistribution of Eu2+ ions in Rb1, Rb2, and Ca sites is achieved by introducing the cation K+ to substitute Rb+, and R2-yKyCPOF: 0.0085Eu2+ (0 ≤ y ≤ 1.8) is kept in the pure phase. Furthermore, the mixed phosphors of RCPOF: 0.0085Eu2+, RKCPOF: 0.0085Eu2+, and R0.2K1.8CPOF: 0.0085Eu2+ show excellent optical performance and good thermal stability. Full-visible spectrum lighting is successfully achieved with the combination of a 395 nm NUV chip and the blend of phosphor-converted WLEDs. The K+ substitution reported in this paper can support a project for warm WLEDs by manipulating the distribution of Eu2+ activator among different cation sites.
HANMANDLU2022132831¡Few-layer fluorine-functionalized graphene hole-selective contacts for efficient inverted perovskite solar cells¡Charge-selective contacts can play a critical role in enhancing the efficiency of perovskite solar cells (PSCs). In this study, we employed fluorine-functionalized graphene (FGr) layers having finely tunable energy levels as hole transport layers (HTLs) to improve the power conversion efficiency (PCE) and stability of inverted PSCs. The non-wetting surface of the FGr enhanced the crystallinity of organic–inorganic perovskites films with large aspect ratios, relative to that of poly(3,4-ethylenedioxythiophene):polystyrenesulfonate (PEDOT:PSS). Combining the high work function of the HTL interface with the enhanced crystallinity and limited grain boundary area dramatically decreased the charge recombination losses in organic–inorganic trihalide perovskite (OTP) films. Thus, when incorporating FGr HTLs in inverted PSCs, the best PCE reached 19.34%—the highest efficiency reported to date for any PSC featuring a functionalized graphene HTL. Furthermore, we used this HTL to prepare flexible PSCs and obtained a highest efficiency of 17.50%. Therefore, this highly applicable and facile interface strategy using functionalized graphene HTLs provides stable PSCs displaying high PCEs.
MILH2022132875¡Degradation of sulfamethoxazole by ferrous iron activated peroxymonosulfate: Elucidation of the degradation mechanism and influence of process parameters¡Ferrous iron activation= Peroxymonosulfate= Sulfamethoxazole= Degradation pathway¡In this research, the activation of peroxymonosulfate (PMS) by ferrous iron (Fe2+) was investigated as a technique for the degradation of sulfamethoxazole (SMX). First, the influence of the Fe2+:PMS molar ratio on the obtained degradation efficiency was investigated and an excess of Fe2+ was found to result in a decrease in SMX degradation efficiency, while, for the investigated molar ratios, an excess of PMS was found to enhance the degradation efficiency. To obtain a higher degradation efficiency, the dosing strategy of the reagents was altered: from direct dosing (introducing the reagents all at once) to sequential dosing (adding the same total amount of reagent, but divided over specific time intervals) and continuous dosing (adding the same total amount of reagent, but continuously over 30 min reaction time). Continuous dosing of both Fe2+ and PMS was found to be the optimal strategy, with a SMX degradation efficiency of 67% in 50 min reaction time. By performing scavenging experiments, the reactive species (•OH, •SO4- and Fe(IV) present in this process were identified. It was found that the contribution of •OH to the degradation of SMX increased when changing from direct to continuous dosing. Lastly, the formed degradation products were identified, and differences in reaction pathway depending on the reactive species present were elucidated.
ZUO2022132996¡A high areal capacity solid-state zinc-air battery via interface optimization of electrode and electrolyte¡Zinc-air battery= High areal capacity= Interface optimization= Porous zinc electrode¡Solid-state zinc-air batteries (SZABs) are regarded as a promising energy source for next-generation wearable electronic devices due to their high theoretical energy density and reliability. However, practical development of solid-state zinc-air batteries is hindered by the low specific areal capacity and poor contact between solid-state electrolyte and electrode caused by zinc passivation and electrolyte aging. Herein, we report a new strategy for optimizing the solid-state electrolyte/electrode interface coupling by combining porous zinc electrode and thermal-sensitive solid-state electrolyte F127 to improve the areal-capacity of solid-state zinc-air batteries. The porous Zn anode prepared by zinc electrodeposition on the zinc substrate is used to alleviate zinc passivation and improve the specific area capacity of SZAB. In addition, to enhance the contact between the solid-state electrolyte and the zinc anode, the F127 surfactant is selected as the solid-state electrolyte due to its fluidity at low temperatures. Benefiting from the porous structure and excellent contact, the SZAB using porous zinc anode and the solid-state electrolyte F127 exhibits high areal capacity of 133 mAh cm−2 at the current density of 4 mA cm−2, which is 100 times higher than that of the solid zinc-air battery using zinc foil as the anode. Moreover, the results show that the use of porous zinc electrodes is conducive to achieving high current discharge, which is critical for the practical application of solid-state zinc-air batteries.
CHEN2022133036¡Anisotropic hydrogels with enhanced mechanical and tribological performance by magnetically oriented nanohybrids¡Anisotropic hydrogels= Magnetic nanoparticles= Montmorillonite= Mechanical properties¡Most current hydrogels have weak mechanical properties and unordered structures, which limits their applications. However, soft tissues with highly ordered hierarchical nanocomposite structures exhibit anisotropic mechanical performance and function to adapt the complex environments. Therefore, the introduction of an ordered nanocomposite structure into hydrogel is an effective strategy to endow the hydrogel with superb mechanical strength and excellent anisotropic functions. Here, we develop a method to create anisotropic hydrogels with significantly enhanced mechanical and tribological properties. Based on mussel adhesion chemistry, polydopamine (PDA) was used as a mediator to control the formation of Fe3O4 nanoparticles on the surface of montmorillonite (MMT). Subsequently, the obtained PDA-Fe3O4-MMT nanohybrids in the polyvinyl alcohol/polyacrylic acid (PVA/PAA) hydrogel matrix were aligned to form an ordered structure using magnetic-induced technology and then frozen in hydrogel form by freezing-thawing and annealing methods. The resulting hydrogels showed an anisotropic microstructure and exhibited outstanding mechanical properties with a tensile strength of 10.65 MPa, toughness of 52.2 MJ/m3, and compressive strength of 4.86 MPa, which is higher than that of the corresponding isotropic hydrogel. More interestingly, the friction coefficient of hydrogel is significantly reduced to as low as 0.038 due to the presence of ordered structure. This work not only improves magnetic induction technology for the preparation of anisotropic hydrogels but also provides a simple and effective method to obtain hydrogels with anisotropic structure, high mechanical strength, and anisotropic properties for potential application in tissue engineering.
YAO2022133020¡Carbon sources driven supernatant micro-particles differentiate in submerged anaerobic membrane bioreactors (AnMBRs)¡Anaerobic membrane bioreactors= Micro-particles= Carbon source= Microbial community¡Recently, micro-particles with a size range of 0.45–10 μm in anaerobic membrane bioreactors (AnMBRs), were rich in microorganisms and characterized as a significant source to membrane fouling. Nevertheless, little is known about the formation of the micro-particles associated microorganisms as well as their metabolic functions, which could be largely impacted by carbon sources in the influent. Here, protein and glucose were chosen to be two different carbon sources fed into two identical AnMBRs (i.e., AnMBR-P and AnMBR-G), and a comprehensive comparison of the micro-particles formed in corresponding reactors was made. Size-dependent fractionation and fluorescent staining assay showed that micro-particles with the size range of 0.45–1 μm possessed the highest contents (41.4%) in the AnMBR-P and presented as vibrios and coccus, while the 5–10 μm micro-particles with filamentous morphologies were the prevailing fraction (61.9%) in the AnMBR-G. According to the results of high-throughput 16S rRNA gene sequencing, the Lentimicrobiaceae, D8A-2 and Syntrophorhabdus prevailed in the AnMBR-P micro-particles, while the SJA-15 showed overwhelming predominance than the other genera in the AnMBR-G micro-particles. Metagenomic sequencing further revealed that the micro-particles in the AnMBR-P possessed higher abundance in specific functional genes for nitrogen metabolism (nirB), sulfur metabolism (cysK) and cysteine and methionine metabolism (mtaD), as well as in the cell mobility as chemotaxis (rbsB) and flagellar assembly (fliC). In comparison, the micro-particles obtained from the AnMBR-G encoded abundant genes for converting glucose to metabolites in the next level, such as glk (glucokinase), pfk (ATP-dependent phosphofructokinase), and PGK (phosphoglycerate kinase). Overall, our findings provided new insights into the formation of micro-particles in the supernatant of AnMBRs, which could facilitate to propose related fouling alleviation methods from the perspective of carbon sources regulation and/or pretreatment of the influent.
LI2022133049¡Quasi-commercial production of SnS-based nanosheets with enhanced thermoelectric performance via a wet chemical synthesis¡Thermoelectric material= Tin sulfide= Nanosheet= Carrier concentration¡Tin sulfide (SnS) is a low-cost, earth-abundant, and eco-friendly thermoelectric (TE) material whose layered orthorhombic structure is similar to that of SnSe; however, current studies on SnS are limited because of its difficult synthesis due to the use of volatile sulfur, and its thermoelectric figure of merit (zT) is also low because of its intrinsically low electrical conductivity. Herein, we present a facile wet chemical synthesis to prepare uniform and well-dispersed SnS nanosheet crystals. Low-rate initial production with 3.5 L solvent was performed to obtain high-quality crystals, and also to adapt the process to commercial preparation. The carrier concentrations were enhanced from 3.2×1018 cm−3 to 4.8×1019 cm−3 (at 873 K) step-by-step via increasing Sn vacancies, adding SnSe, and embedding Ag atoms. The maximum power factor (PF) at 873 K of 0.48×10−3 W⋅m−1K−2 was achieved in the selenium-silver co-doped sample, which presented a state-of-the-art value for the polycrystalline SnS. Correspondingly, the lattice thermal conductivities (κL) decreased from 0.8 W⋅m−1K−1 to 0.47 W⋅m−1K−1 (at 873 K) due to enhanced phonon scattering. The highest zT was 0.80 at 873 K, which is about 5 or 6 times higher than those of the pristine SnS(1:1) or SnS(1:0.8) samples. These findings provide a novel method to prepare high-quality and high-performance TE semiconductors via a wet chemical synthesis.
GUO2022132984¡Magnetically anchored antibody-coupled nanocomposite as α-Amylase inhibitor for long-time protection against glycemic variability¡IgY= Immune response= Nanoparticle= Diabetes¡Glycemic variability is an important risk factor for metabolic diseases such as diabetes, obesity and cardiovascular diseases, which are closely related to life and diet style. Random eating or eating irregular meals and poor patient compliance with lifestyle changes often happens and makes more difficult to control glycemic variability in life through hypoglycemic drugs around meals. The inhibition of the activity of digestion enzymes in the gut represents an effective strategy for prevention and treatment of glycemic variability. In this study, immune response was employed to induce antibodies (immunoglobulin of egg yolk, IgY) against α-amylase through the subcutaneous injection of α-amylase as the antigen in laying hens. IgY-coupled magnetic nanocomposite hydrogel as α-amylase inhibitor was further developed for long-time against glycemic variability. IgY was covalently coupled to PEG-coated Fe3O4 nanoparticles (PEG/Fe3O4@IgY nanoparticles) and then fabricated by embedding of PEG/Fe3O4@IgY nanoparticles in chitosan-alginate (CS/AS) hydrogels. Under the external magnetic field, lgY-coupled magnetic nanocomposites as α-amylase inhibitors were magnetically anchored in the small intestine for long-time against glycemic variability, resulting in a long-time (>36 h) and effective postprandial hyperglycemia management. This study opens a new door to the health care of the metabolic diseases such as diabetes, obesity and cardiovascular disease.
WANG2022133065¡Hydrophobic π-conjugated organic small molecule as a multi-functional interface material enables efficient and stable perovskite solar cells¡Perovskite Solar Cell= Stability= π-conjugated¡Surface treatment of perovskite films with interface materials is an effective strategy to resolve trap-mediated nonradiative recombination toward high efficiency and stability of perovskite solar cells (PSCs). However, interface materials for multi-functional treatment have been rarely investigated in PSCs. In this work, a novel pyrene-based organic material (TAAPyr) is first introduced as a defect passivation layer and a protect layer against moisture for PSCs application. With the TAAPyr interfacial modification, both perovskite surface defects and nonradiative recombination are effectively decreased as well as the carrier transport in device is also enhanced, As a consequence, the best power conversion efficiencies (PCE) up to 22.45% for TAAPyr-based device was obtained, clearly outperforming the control one (20.37%). Moreover, it was found that the π-conjugated TAAPyr can promote intermolecular face-to-face stacking on the surface perovskite film, which is favorable to making the perovskite surface more hydrophobic and consequently enhance PSCs long-term stability. The un-encapsulated PSCs can retain 92% of the initial PCE after storage for 600 h at ∼65% RH, in comparison with 64% efficiency retention of the device without TAAPyr under the same conditions. This work presents a new strategy to enhance the efficiency and stability of PSCs by multi-functional π–conjugated passivator.
